{
  "schema": "redengine-native/1",
  "profile_id": "cyberpunk-2077-redengine4-native-steam-20383525",
  "game": {
    "slug": "cyberpunk-2077",
    "display_name": "Cyberpunk 2077",
    "steam_app_id": "1091500",
    "steam_buildid_observed": "20383525",
    "launcher_executable": "REDprelauncher.exe",
    "shipping_binary": "bin\\x64\\Cyberpunk2077.exe",
    "executable_sha256_observed": "a7de82945c03e041fc7339fcf9066224d98db2f5d80fea50f7947bb350a60991",
    "adapter_build_id": "steam-1091500-build-20383525"
  },
  "engine": {
    "family": "redengine",
    "major": 4,
    "integration": "red4ext"
  },
  "renderer": {
    "expected_api": "d3d12",
    "runtime_backend": "d3d12",
    "observation_state": "game_verified"
  },
  "loading": {
    "mode": "red4ext_plugin",
    "proxy_dll_forbidden": true,
    "activation_mode": "managed_session",
    "state": "planned"
  },
  "dependencies": [
    {
      "path": "red4ext\\red4ext.dll",
      "reason": "RED4ext is the supported native plugin loading seam"
    },
    {
      "path": "red4ext\\plugins\\CyberpunkVR_Stereo\\CyberpunkVR_Stereo.dll",
      "reason": "VRClient's managed Cyberpunk backend uses the MIT engine-aware final-frame and OpenXR stereo plugin"
    },
    {
      "path": "red4ext\\plugins\\CyberpunkVR_Stereo\\CyberpunkVR_SightPs.dxil",
      "reason": "The engine-aware backend loads its pixel shader by this exact name"
    },
    {
      "path": "red4ext\\plugins\\CyberpunkVR_Stereo\\CyberpunkVR_SightVs.dxil",
      "reason": "The engine-aware backend loads its vertex shader by this exact name"
    },
    {
      "path": "bin\\x64\\plugins\\cyber_engine_tweaks.asi",
      "reason": "The isolated VRCAM proof uses CET only to enable one authored camera component"
    },
    {
      "path": "red4ext\\plugins\\Codeware\\Codeware.dll",
      "reason": "Codeware exposes live REDengine entity components to the CET VRCAM selector"
    },
    {
      "path": "red4ext\\plugins\\ArchiveXL\\ArchiveXL.dll",
      "reason": "CyberpunkVR Port declares ArchiveXL as a runtime framework dependency"
    },
    {
      "path": "red4ext\\plugins\\TweakXL\\TweakXL.dll",
      "reason": "CyberpunkVR Port declares TweakXL as a runtime framework dependency"
    },
    {
      "path": "engine\\tools\\scc.exe",
      "reason": "redscript is required to compile RED4ext and gameplay script extensions"
    },
    {
      "path": "archive\\pc\\mod\\cyberpunkvrport.archive",
      "reason": "MIT reference asset supplies disabled REDengine render-to-texture camera components"
    },
    {
      "path": "r6\\scripts\\CyberpunkVRPort_NoAnims\\vrport_no_anims.reds",
      "reason": "MIT comfort slice disables locomotion head bob, melee camera shake, recoil kick, and sprint weapon-lower animation that conflict with HMD/controller tracking"
    },
    {
      "path": "bin\\x64\\plugins\\cyber_engine_tweaks\\mods\\CyberpunkVRPort_Stereo\\init.lua",
      "reason": "Official CyberpunkVR Port 0.1.7 camera selector by dariulone"
    },
    {
      "path": "bin\\x64\\plugins\\cyber_engine_tweaks\\mods\\CyberpunkVRPort_VRIK\\init.lua",
      "reason": "Official upstream avatar and controller pose bridge"
    },
    {
      "path": "red4ext\\plugins\\CyberpunkVR_Stereo\\CyberpunkVR_VisionCs.dxil",
      "reason": "Required by the official 0.1.7 release"
    },
    {
      "path": "r6\\scripts\\CyberpunkVRPort_Holster\\vrport_holster.reds",
      "reason": "Required by the official 0.1.7 release"
    }
  ],
  "conflicts": [
    {
      "path": "bin\\x64\\dxgi.dll",
      "reason": "DXGI proxy VR/render hooks can duplicate or recurse with the RED4ext bridge"
    },
    {
      "path": "bin\\x64\\d3d12.dll",
      "reason": "D3D12 proxy hooks can conflict with VRClient device and queue observation"
    },
    {
      "path": "red4ext\\plugins\\VRClient.REDengine",
      "reason": "The retired experimental target-histogram bridge must stay outside RED4ext's recursive DLL scan tree"
    },
    {
      "path": "red4ext\\plugins\\CyberpunkVR_Hands\\CyberpunkVR_Hands.dll",
      "reason": "0.1.7 incorporates hands into Stereo; the old DLL would detour the same hooks twice"
    }
  ],
  "conversion": {
    "stereo_method": "engine_second_view",
    "ownership": {
      "runtime": "vrclient",
      "stereo": "vrclient",
      "camera": "vrclient",
      "input": "vrclient",
      "submission": "vrclient"
    },
    "capabilities": {
      "red4ext_bridge": "planned",
      "graphics_bridge": "planned",
      "stereo_views": "planned",
      "head_tracking": "planned",
      "hud": "planned",
      "gamepad_fallback": "planned",
      "motion_controls": "planned"
    }
  },
  "distribution": {
    "commercial_use": false,
    "ship_game_assets": false,
    "upstream_source_license": "MIT",
    "attribution_required": true,
    "human_legal_review_required": true
  },
  "verification": {
    "status": "preflight_ready",
    "evidence": [
      "2026-10-18: Official 0.1.7 tag a0c23fe110530bb74a73b3adf1ffa7d83050c43d; archive SHA-256 A77B211D4DB4E75B61B08951762E9034F60511731F3A441F21B11D1F723C7C84 verified against the author's GitHub release asset digest.",
      "The earlier 0.1.2 Quest 2 headset evidence remains historical; it does not verify 0.1.7.",
      "Unmodified official package is downloaded directly from dariulone. AVRcade parks its files outside mod scan paths between VR sessions.",
      "More Occluders (Scripted v0.3) is a separate upstream requirement; no local 0.1.7 headset acceptance has been recorded."
    ]
  }
}
